{
  "$schema": "https://json-schema.org/draft/2020-12/schema",
  "$id": "https://formspec.org/schemas/experience/1.0",
  "title": "Formspec Experience",
  "description": "A Formspec Experience Document per the Experience specification. A standalone sidecar that names abstract task intent: actors, tasks, units, applicability, and typed references to items, concepts, and actions. Like Theme, Component, Locale, and References documents, an Experience Document lives alongside the artifacts it describes. Scope is set by targetDefinition: present binds the Experience to one Definition (multiple Experience Documents MAY target the same Definition — different actor populations, platforms, or postures); absent makes the Experience bundle-scoped, naming task intent across the App Manifest bundle rather than one Definition, which is the only representable posture for an app envelope with an empty definitions[] (ADR 0150 §5.2). Experience metadata MUST NOT alter core behavioral semantics (required, relevant, readonly, calculate, validation).",
  "type": "object",
  "required": ["$formspecExperience", "version"],
  "additionalProperties": false,
  "patternProperties": {
    "^x-": {}
  },
  "properties": {
    "$formspecExperience": {
      "type": "string",
      "const": "1.0",
      "description": "Experience specification version. MUST be '1.0'.",
      "examples": ["1.0"],
      "x-lm": {
        "critical": true,
        "intent": "Version pin for experience document compatibility"
      }
    },
    "modules": {
      "type": "array",
      "description": "OPTIONAL declaration of substrate modules this document depends on. Each entry is a canonical ModuleRef (id + version, with optional publisher + lockHash for posture admission). Default-module-set behavior per ADR 0150 §4.9 preserves form-only documents — omitting modules[] is identical to declaring the core module set. Per ADR 0150 §4.3.",
      "items": {
        "$ref": "https://formspec.org/schemas/common/1.0#/$defs/ModuleRef"
      },
      "examples": [
        [{ "id": "x-formspec-core-task", "version": "^1.0.0" }]
      ]
    },
    "version": {
      "type": "string",
      "minLength": 1,
      "description": "Version of this Experience Document. SemVer is RECOMMENDED.",
      "examples": ["1.0.0"],
      "x-lm": {
        "critical": true,
        "intent": "Experience document revision identifier"
      }
    },
    "targetDefinition": {
      "$ref": "#/$defs/TargetDefinition",
      "description": "OPTIONAL binding to the target Definition document. Same shape as Theme / Component / Locale. PRESENT — the Experience is Definition-scoped: processors resolve it against the loaded Definition, verify the URL match and compatibleVersions range, and compute coverage against that Definition. ABSENT — the Experience is bundle-scoped per the ADR 0150 §5.2 app envelope: it names task intent for the bundle whose App Manifest lists it, not for a single Definition, which is the only representable posture when definitions[] is empty (a pure non-form app). A bundle-scoped Experience forms no (Definition, Experience) pair, so every processing step that reads a loaded Definition — target resolution, item-ref resolvability, and coverage — is inapplicable rather than failing and emits no finding (experience-spec S10.1, the single normative statement); a processor MUST NOT infer a binding to whatever Definition is loaded. An Experience carrying Definition-keyed content (units[].itemRefs) SHOULD declare targetDefinition — those paths have no anchor without one.",
      "examples": [
        { "url": "https://example.gov/forms/intake", "compatibleVersions": ">=1.0.0 <2.0.0" }
      ],
      "x-lm": {
        "critical": true,
        "intent": "Target Definition URL and compatible-versions range, or — omitted — bundle scope"
      }
    },
    "name": {
      "type": "string",
      "pattern": "^[a-zA-Z][a-zA-Z0-9_\\-]*$"
    },
    "title": { "type": "string" },
    "description": { "type": "string" },
    "applicability": { "$ref": "#/$defs/Applicability" },
    "actors": {
      "type": "array",
      "items": { "$ref": "#/$defs/Actor" },
      "uniqueItems": true
    },
    "tasks": {
      "type": "array",
      "items": { "$ref": "#/$defs/Task" },
      "uniqueItems": true
    },
    "units": {
      "type": "array",
      "description": "Substantive Experience payload. Each Unit organizes typed item, concept, and action references under abstract task intent.",
      "items": { "$ref": "#/$defs/Unit" },
      "examples": [
        [
          {
            "id": "identity",
            "kind": "data-entry",
            "itemRefs": [{ "path": "applicantName" }]
          }
        ]
      ],
      "x-lm": {
        "critical": true,
        "intent": "Substantive payload; units organize typed references under tasks"
      }
    },
    "extensions": {
      "$ref": "#/$defs/Extensions"
    }
  },
  "$defs": {
    "TargetDefinition": {
      "$ref": "https://formspec.org/schemas/common/1.0#/$defs/TargetDefinition"
    },
    "Extensions": {
      "$ref": "https://formspec.org/schemas/common/1.0#/$defs/Extensions"
    },
    "Actor": {
      "type": "object",
      "required": ["id"],
      "additionalProperties": false,
      "properties": {
        "id": {
          "type": "string",
          "pattern": "^[a-zA-Z][a-zA-Z0-9_]*$",
          "description": "Stable identifier for this Actor. Unique within actors[].",
          "examples": ["applicant", "reviewer"]
        },
        "title": { "type": "string" },
        "description": { "type": "string" },
        "extensions": {
          "$ref": "#/$defs/Extensions"
        }
      }
    },
    "Task": {
      "type": "object",
      "required": ["id"],
      "additionalProperties": false,
      "properties": {
        "id": {
          "type": "string",
          "pattern": "^[a-zA-Z][a-zA-Z0-9_]*$",
          "description": "Stable identifier for this Task. Unique within tasks[]. Referenced by Component nodes via taskRefs[].",
          "examples": ["identifyApplicant", "reviewEligibility"]
        },
        "title": { "type": "string" },
        "description": { "type": "string" },
        "actorRefs": {
          "type": "array",
          "items": { "type": "string", "pattern": "^[a-zA-Z][a-zA-Z0-9_]*$" }
        },
        "extensions": {
          "$ref": "#/$defs/Extensions"
        }
      }
    },
    "Unit": {
      "type": "object",
      "required": ["id", "kind"],
      "additionalProperties": false,
      "properties": {
        "id": {
          "type": "string",
          "pattern": "^[a-zA-Z][a-zA-Z0-9_]*$",
          "description": "Stable identifier for this Unit. Unique within units[]. Referenced by Component nodes via unitRef.",
          "examples": ["identity", "householdReview", "submitConfirmation"]
        },
        "kind": {
          "$ref": "#/$defs/UnitKind"
        },
        "title": { "type": "string" },
        "description": { "type": "string" },
        "actorRef": {
          "type": "string",
          "pattern": "^[a-zA-Z][a-zA-Z0-9_]*$",
          "description": "Actor this unit is intended for. MUST resolve to actors[].id."
        },
        "taskRefs": {
          "type": "array",
          "items": { "type": "string", "pattern": "^[a-zA-Z][a-zA-Z0-9_]*$" },
          "description": "Tasks this unit advances. Each MUST resolve to tasks[].id."
        },
        "itemRefs": {
          "type": "array",
          "items": { "$ref": "#/$defs/ItemRef" }
        },
        "conceptRefs": {
          "type": "array",
          "items": { "$ref": "#/$defs/ConceptRef" }
        },
        "needRefs": {
          "type": "array",
          "items": { "$ref": "#/$defs/NeedRef" },
          "description": "Needs this unit serves, in the paired Needs Document (needs-spec S7). Inverse of the OSLC-RM satisfiedBy edge, carried on the satisfying side. Deliberately unpinned — no revision — so a copy-edit to a Statement never invalidates authored intent; pinning is the need: anchor's job."
        },
        "actionRefs": {
          "type": "array",
          "items": { "$ref": "#/$defs/ActionRef" }
        },
        "applicability": { "$ref": "#/$defs/Applicability" },
        "accessibility": { "$ref": "#/$defs/Accessibility" },
        "extensions": {
          "$ref": "#/$defs/Extensions"
        }
      }
    },
    "UnitKind": {
      "oneOf": [
        {
          "type": "string",
          "enum": [
            "data-entry",
            "review",
            "confirmation",
            "evidence-collection",
            "attestation",
            "error-resolution",
            "assistance"
          ]
        },
        {
          "type": "string",
          "pattern": "^x-[a-z][a-z0-9]*(-[a-z][a-z0-9]*)*$",
          "description": "Module-contributed UnitKind extension per ADR 0150 §4.5/§4.9. MUST resolve against a declared `unit-kind` contribution from a module in the document's `modules[]` (lint E603 enforces resolution)."
        }
      ],
      "description": "Closed-core task-oriented unit kind OR a module-contributed `x-` extension (ADR 0150 §4.5). Closed-core values: data-entry (user provides or revises data), review (read-only display of captured data), confirmation (user affirms accuracy before a transition), evidence-collection (user supplies evidence — attachments, attestations), attestation (user certifies a statement under accountability), error-resolution (user resolves a validation finding), assistance (user receives help). Extension values follow the canonical `^x-[a-z][a-z0-9]*(-[a-z][a-z0-9]*)*$` regex (§4.8).",
      "examples": ["data-entry", "review", "confirmation", "x-publisher-custom-kind"],
      "x-lm": {
        "critical": true,
        "intent": "Closed-core enum + module-extensible x- branch per ADR 0150 §4.5"
      }
    },
    "ItemRef": {
      "type": "object",
      "required": ["path"],
      "additionalProperties": false,
      "properties": {
        "path": {
          "type": "string",
          "minLength": 1,
          "description": "Canonical Definition item path using Core FieldRef syntax. For repeat-group children use the [*] wildcard path (e.g., household.members[*].firstName).",
          "examples": ["applicantName", "household.members[*].firstName"]
        },
        "purpose": {
          "type": "string",
          "enum": ["collect", "display", "attest", "cite"],
          "description": "User-facing purpose. Default depends on enclosing unit.kind (S6.1)."
        },
        "description": { "type": "string" },
        "extensions": {
          "$ref": "#/$defs/Extensions"
        }
      }
    },
    "ConceptRef": {
      "type": "object",
      "required": ["id"],
      "additionalProperties": false,
      "properties": {
        "id": {
          "type": "string",
          "minLength": 1,
          "description": "Registry / Ontology concept identifier."
        },
        "source": {
          "type": "string",
          "enum": ["registry", "ontology", "external"],
          "default": "registry"
        },
        "description": { "type": "string" },
        "extensions": {
          "$ref": "#/$defs/Extensions"
        }
      }
    },
    "NeedRef": {
      "type": "object",
      "required": ["id"],
      "additionalProperties": false,
      "description": "Citation from an Experience Unit to a Need it serves (needs-spec S7). Resolves against the caller-paired Needs Document; when none is paired, resolution is inapplicable and emits nothing.",
      "properties": {
        "id": {
          "type": "string",
          "pattern": "^[a-zA-Z][a-zA-Z0-9_-]*$",
          "description": "A need.id in the paired Needs Document. Deliberately unpinned: no revision — the Unit serves the Need as currently worded (needs-spec S7).",
          "examples": ["proof-of-filing"],
          "x-lm": {
            "critical": true,
            "intent": "The unit-to-need citation half of the coverage predicate"
          }
        },
        "description": { "type": "string" },
        "completion": {
          "$ref": "#/$defs/NeedCompletion",
          "description": "Optional declaration of the kind of usable outcome this Unit is expected to provide for the cited Need. The declaration stays on the satisfying side and names no route, widget, or implementation target. Advisory AppGraph UX lint matches the shape to directly Need-traced, mounted, resolved output without claiming runtime authorization or successful completion."
        },
        "extensions": {
          "$ref": "#/$defs/Extensions"
        }
      }
    },
    "NeedCompletion": {
      "type": "object",
      "required": ["shape"],
      "additionalProperties": false,
      "description": "Closed, implementation-independent classification of the usable outcome expected to satisfy a Need citation. Direct need:<id>@<revision> anchors identify candidate outputs; this declaration does not place controls or alter runtime behavior.",
      "properties": {
        "shape": {
          "type": "string",
          "enum": [
            "action",
            "submitted-definition",
            "resource",
            "navigation",
            "observable-result"
          ],
          "description": "Expected usable outcome: an operable action, a submitted Definition flow, a usable resource, navigation to a destination, or a result the person can observe."
        }
      }
    },
    "ActionRef": {
      "type": "object",
      "required": ["id"],
      "additionalProperties": false,
      "properties": {
        "id": {
          "type": "string",
          "minLength": 1,
          "description": "Response Action identifier. MUST resolve against the loaded Response Actions document's actions[*].id set."
        },
        "role": {
          "type": "string",
          "enum": ["primary", "secondary", "escape"],
          "default": "primary"
        },
        "description": { "type": "string" },
        "extensions": {
          "$ref": "#/$defs/Extensions"
        }
      }
    },
    "Applicability": {
      "type": "object",
      "additionalProperties": false,
      "properties": {
        "actorRefs": {
          "type": "array",
          "items": { "type": "string", "pattern": "^[a-zA-Z][a-zA-Z0-9_]*$" }
        },
        "platforms": {
          "type": "array",
          "items": { "type": "string", "minLength": 1 },
          "description": "Open enum. Common values: web, mobile, pdf, cli, voice, agent."
        },
        "locales": {
          "type": "array",
          "items": { "type": "string", "pattern": "^[a-zA-Z]{2,3}(-[A-Za-z0-9]+)*$" },
          "description": "BCP 47 locale tags."
        },
        "posture": { "type": "string" },
        "channels": {
          "type": "array",
          "items": { "type": "string", "minLength": 1 }
        },
        "extensions": {
          "$ref": "#/$defs/Extensions"
        }
      }
    },
    "Accessibility": {
      "type": "object",
      "additionalProperties": false,
      "properties": {
        "assistive": { "type": "boolean", "default": true },
        "complexity": { "type": "string", "enum": ["low", "moderate", "high"] },
        "requiresLiteracy": { "type": "boolean" },
        "extensions": {
          "$ref": "#/$defs/Extensions"
        }
      }
    }
  }
}
